### ISSUE TITLE
uWSGI with HTTPs connect failure on continues HTTPs request

### ISSUE THREAD

**Issue by rpgiri2002** [miguelgrinberg/Flask-SocketIO#915]
I am running uWSGI+Swagger Python Flask server on Rasberry Pi (HTTPS). With continues POST, the request on client side fails (EOF from Golang). It looks like after couple of https request, uWSGI closes the connection (TLS1.2 97 Encrypted Alert). 
Same client works fine if I run only swagger python flask server (removing uWSGI). Running only swagger python flask server, I don't see TLSv1.2 07 Encrypted Alert (21) triggering from Flask server end.

Any pointers on why uWSGI triggering TLS1.2 97 Encrypted Alert? How can solve this connection termination problem.

172.16.2.184 (uWSGI-Swagger Server)
172.16.1.228 (Client )

       Source       Destination
242  172.16.2.184   172.16.1.228    TLSv1.2 1007    Application Data
243  172.16.2.184    172.16.1.228    TLSv1.2 97  Encrypted Alert 
244  172.16.1.228   172.16.2.184    TLSv1.2 845 Application Data
245  172.16.2.184   172.16.1.228    TCP 54  9091 → 48880 [RST] Seq=2307 Win=0 Len=0
246  172.16.1.228   172.16.2.184    TLSv1.2 97  Encrypted Alert
247  172.16.2.184   172.16.1.228    TCP 54  9091 → 48880 [RST] Seq=2339 Win=0 Len=0
248  172.16.1.228   172.16.2.184    TCP 66  48880 → 9091 [FIN, ACK] Seq=1289 Ack=2339 Win=34816 Len=0 TSval=2352751394 TSecr=1806970985
249  172.16.2.184   172.16.1.228    TCP 54  9091 → 48880 [RST] Seq=2339 Win=0 Len=0

**Comment by miguelgrinberg** [comment]
How is this problem related to Flask-SocketIO? Seems like you have a much more basic/lower level problem. I suggest you ask in Stack Overflow, and include your server configuration and how you are starting it.
